Movie_Description,Action,Sci-Fi,Comedy,Crime,Western,Family,Drama,Horror,Romance,Thriller,Adventure
"In the small town of Chanderi, the menfolk live in fear of an evil spirit named ""Stree"" who abducts men in the night. Based on the urban legend of ""Nale Ba"" that went viral in Karnataka in the 1990s.",0,0,1,0,0,0,0,1,0,0,0
"Pakistan-born comedian Kumail Nanjiani and grad student Emily Gardner fall in love but struggle as their cultures clash. When Emily contracts a mysterious illness, Kumail finds himself forced to face her feisty parents, his family's expectations, and his true feelings.",0,0,1,0,0,0,1,0,1,0,0
"Simon Spier keeps a huge secret from his family, his friends and all of his classmates: he's gay. When that secret is threatened, Simon must face everyone and come to terms with his identity.",0,0,1,0,0,0,1,0,1,0,0
A man who has made a new life for himself and the daughter left on his doorstep 6 years ago finds his family threatened when the birth mother resurfaces.,0,0,1,0,0,0,1,0,0,0,0
"Boy, an 11-year-old child and devout Michael Jackson fan who lives on the east coast of New Zealand in 1984, gets a chance to know his absentee criminal father, who has returned to find a bag of money he buried years ago.",0,0,1,0,0,0,1,0,0,0,0
"Through his bond with his owner, aspiring Formula One race car driver Denny, golden retriever Enzo learns that the techniques needed on the racetrack can also be used to successfully navigate the journey of life.",0,0,1,0,0,0,1,0,1,0,0
Affable hillbillies Tucker and Dale are on vacation at their dilapidated mountain cabin when they are mistaken for murderers by a group of preppy college students.,0,0,1,0,0,0,0,1,0,0,0
"Faced with an unplanned pregnancy, an offbeat young woman makes an unusual decision regarding the unborn child.",0,0,1,0,0,0,1,0,0,0,0
"Satirical comedy follows the machinations of Big Tobacco's chief spokesman, Nick Naylor, who spins on behalf of cigarettes while trying to remain a role model for his 12-year old son.",0,0,1,0,0,0,1,0,0,0,0
"Two men reaching middle age with not much to show but disappointment embark on a week-long road trip through California's wine country, just as one is about to take a trip down the aisle.",0,0,1,0,0,0,1,0,1,0,0
"After being mistaken for an actor, a New York thief is sent to Hollywood to train under a private eye for a potential movie role, but the duo are thrown together with a struggling actress into a murder mystery.",0,0,1,1,0,0,0,0,0,0,0
"As adults, best friends Julien and Sophie continue the odd game they started as children -- a fearless competition to outdo one another with daring and outrageous stunts. While they often act out to relieve one another's pain, their game might be a way to avoid the fact that they are truly meant for one another.",0,0,1,0,0,0,1,0,1,0,0
"During his final days, a dying man is reunited with old friends, former lovers, his ex-wife, and his estranged son.",0,0,1,1,0,0,1,0,0,0,0
"A coming-of-age story about a shy, young boy sent by his irresponsible mother to spend the summer with his wealthy, eccentric uncles in Texas.",0,0,1,0,0,1,1,0,0,0,0
"Two teenage girls in small-town Sweden. Elin is beautiful, popular, and bored with life. Agnes is friendless, sad, and secretly in love with Elin.",0,0,1,0,0,0,1,0,1,0,0
"Two 1990s teenage siblings find themselves in a 1950s sitcom, where their influence begins to profoundly change that complacent world.",0,0,1,0,0,0,1,0,0,0,0
Two drag performers and a transgender woman travel across the desert to perform their unique style of cabaret.,0,0,1,0,0,0,0,0,0,0,0
"A Hollywood studio executive is being sent death threats by a writer whose script he rejected, but which one?",0,0,1,1,0,0,1,0,0,0,0
"When their best friends announce that they're separating, a professor and his wife discover the faults in their own marriage.",0,0,1,0,0,0,1,0,1,0,0
"A young man's mother is bitten by a Sumatran rat-monkey. She gets sick and dies, at which time she comes back to life, killing and eating dogs, nurses, friends, and neighbors.",0,0,1,0,0,0,0,1,0,0,0
"A former radio DJ, suicidally despondent because of a terrible mistake he made, finds redemption in helping a deranged homeless man who was an unwitting victim of that mistake.",0,0,1,0,0,0,1,0,0,0,0
The Griswold family's plans for a big family Christmas predictably turn into a big disaster.,0,0,1,0,0,0,0,0,0,0,0
Three stories are connected by a Memphis hotel and the spirit of Elvis Presley.,0,0,1,1,0,0,1,0,0,0,0
A television actress encounters a variety of eccentric characters after embarking on a journey to discover why her lover abruptly left her.,0,0,1,0,0,0,1,0,0,0,0
"In London, four very different people team up on a jewel heist, then try to double-cross one another for the loot, complicated by their efforts to fool a very proper barrister.",0,0,1,1,0,0,0,0,0,0,0
"The spirits of a deceased couple are harassed by an unbearable family that has moved into their home, and hire a malicious spirit to drive them out.",0,0,1,0,0,0,0,0,0,0,0
A snobbish investor and a wily street con artist find their positions reversed as part of a bet by two callous millionaires.,0,0,1,0,0,0,0,0,0,0,0
The comedy team takes a look at life in all of its stages in their own uniquely silly way.,0,0,1,0,0,0,0,0,0,0,0
Two American college students on a walking tour of Britain are attacked by a werewolf that none of the locals will admit exists.,0,0,1,0,0,0,0,1,0,0,0
"Claude Bukowski leaves the family ranch in Oklahoma for New York where he is rapidly embraced into the hippie group of youngsters led by Berger, yet he's already been drafted. He soon falls in love with Sheila Franklin, a rich girl but still a rebel inside.",0,0,1,0,0,0,1,0,0,0,0
"Private investigator Philip Marlowe helps a friend out of a jam, but in doing so gets implicated in his wife's murder.",0,0,1,1,0,0,1,0,0,0,0
An anthology of the best sketches from the first and second seasons of Monty Python's Flying Circus (1969).,0,0,1,0,0,0,0,0,0,0,0
A stage-play producer devises a plan to make money by producing a sure-fire flop.,0,0,1,0,0,0,0,0,0,0,0
The daughter of an art forger teams up with a burglar to steal one of her father's forgeries and protect his secret.,0,0,1,1,0,0,0,0,1,0,0
A successful song-and-dance team become romantically involved with a sister act and team up to save the failing Vermont inn of their former commanding general.,0,0,1,0,0,0,0,0,1,0,0
"Stuck in a time loop, two wedding guests develop a budding romance while living the same day over and over again.",0,0,1,0,0,0,0,0,0,0,0
A basketball scout discovers a phenomenal street ball player while in Spain and sees the prospect as his opportunity to get back into the NBA.,0,0,1,0,0,0,1,0,0,0,0
"While on probation, a man begins to re-evaluate his relationship with his volatile best friend.",0,0,1,1,0,0,1,0,0,0,0
An introverted teenage girl tries to survive the last week of her disastrous eighth grade year before leaving to start high school.,0,0,1,0,0,0,1,0,0,0,0
"In 2002, an artistically inclined seventeen-year-old girl comes of age in Sacramento, California.",0,0,1,0,0,0,1,0,0,0,0
"A New York woman (who doesn't really have an apartment) apprentices for a dance company (though she's not really a dancer) and throws herself headlong into her dreams, even as the possibility of realizing them dwindles.",0,0,1,0,0,0,1,0,1,0,0
A week in the life of a young singer as he navigates the Greenwich Village folk scene of 1961.,0,0,1,0,0,0,1,0,0,0,0
"A chance encounter between a down-and-out music-business executive and a young singer-songwriter, new to Manhattan, turns into a promising collaboration between the two talents.",0,0,1,0,0,0,1,0,0,0,0
"Shy 14-year-old Duncan goes on summer vacation with his mother, her overbearing boyfriend, and her boyfriend's daughter. Having a rough time fitting in, Duncan finds an unexpected friend in Owen, manager of the Water Wizz water park.",0,0,1,0,0,0,1,0,0,0,0
"A middle-aged husband's life changes dramatically when his wife asks him for a divorce. He seeks to rediscover his manhood with the help of a newfound friend, Jacob, learning to pick up girls at bars.",0,0,1,0,0,0,1,0,1,0,0
A political satire about a group of skeptical American and British operatives attempting to prevent a war between two countries.,0,0,1,0,0,0,0,0,0,0,0
"Ryan Bingham enjoys living out of a suitcase for his job, travelling around the country firing people, but finds that lifestyle threatened by the presence of a potential love interest, and a new hire presenting a new business model.",0,0,1,0,0,0,1,0,1,0,0
"Prison guard Vince tells Molly from acting class, that one inmate is his 24 y.o. love child. Vince takes him home to stay with his family - straight A son with fat girl fetish, college dropout/stripper daughter and cute wife.",0,0,1,0,0,0,1,0,0,0,0
"An NRI and his wife decide to stay in his ancestral home, paying no heed to the warnings about ghosts. Soon, inexplicable occurrences cause him to call a psychiatrist to help solve the mystery.",0,0,1,0,0,0,0,1,0,0,0
"A young Jewish American man, with the help of an eccentric local, endeavors to find the woman who saved his grandfather during World War II in a Ukrainian village that was ultimately razed by the Nazis.",0,0,1,0,0,0,1,0,0,0,0
"An Eastern European tourist unexpectedly finds himself stranded in JFK airport, and must take up temporary residence there.",0,0,1,0,0,0,1,0,1,0,0
A quietly troubled young man returns home for his mother's funeral after being estranged from his family for a decade.,0,0,1,0,0,0,1,0,1,0,0
A behind-the-scenes look into the highly competitive and cut-throat world of dog shows through the eyes of a group of ruthless dog owners.,0,0,1,0,0,0,0,0,0,0,0
"Rob, a record store owner and compulsive list maker, recounts his top five breakups, including the one in progress.",0,0,1,0,0,0,1,0,0,0,0
In the early 1980s Stevo and Heroin Bob are the only two dedicated punks in conservative Salt Lake City.,0,0,1,0,0,0,1,0,0,0,0
"After being released from prison, Billy is set to visit his parents with his wife, whom he does not actually have. This provokes Billy to act out, as he kidnaps a girl and forces her to act as his wife for the visit.",0,0,1,0,0,0,1,0,1,0,0
An aspiring director and the marginally talented amateur cast of a hokey small-town Missouri musical production go overboard when they learn that someone from Broadway will be in attendance.,0,0,1,0,0,0,0,0,0,0,0
"An awkward seventh-grader struggles to cope with inattentive parents, snobbish class-mates, a smart older brother, an attractive younger sister and her own insecurities in suburban New Jersey.",0,0,1,0,0,0,1,0,0,0,0
"A Brooklyn smoke shop is the center of neighborhood activity, and the stories of its customers.",0,0,1,0,0,0,1,0,0,0,0
"In New York in 1928, a struggling playwright is forced to cast a mobster's talentless girlfriend in his latest drama in order to get it produced.",0,0,1,1,0,0,0,0,0,0,0
"A sardonic hardware store clerk is accidentally transported to 1300 A.D., where he must retrieve the Necronomicon and battle an army of the dead so he can return home.",0,0,1,0,0,0,0,1,0,0,0
A film crew follows a ruthless thief and heartless killer as he goes about his daily routine. But complications set in when the film crew lose their objectivity and begin lending a hand.,0,0,1,1,0,0,1,0,0,0,0
Two con men try to settle their rivalry by betting on who can swindle a young American heiress out of fifty thousand dollars first.,0,0,1,1,0,0,0,0,0,0,0
A nostalgic look at radio's golden age focusing on one ordinary family and the various performers in the medium.,0,0,1,0,0,0,0,0,0,0,0
"A New Yorker's life is thrown into a tailspin when his younger cousin surprise-visits him, starting a strange, unpredictable adventure.",0,0,1,0,0,0,1,0,0,0,0
"In his attempts to reconcile a lounge singer with his mistress, a hapless talent agent is mistaken as her lover by a jealous gangster.",0,0,1,0,0,0,0,0,0,0,0
"Follows hard-to-please Aurora looking for love, and her daughter's family problems.",0,0,1,0,0,0,1,0,0,0,0
"Michael Dorsey, an unsuccessful actor, disguises himself as a woman in order to get a role on a trashy hospital soap.",0,0,1,0,0,0,1,0,1,0,0
"At a 1962 college, Dean Vernon Wormer is determined to expel the entire Delta Tau Chi Fraternity, but those troublemakers have other plans for him.",0,0,1,0,0,0,0,0,0,0,0
A newly-engaged couple have a breakdown in an isolated area and must seek shelter at the bizarre residence of Dr. Frank-n-Furter.,0,0,1,0,0,0,0,1,0,0,0
A group of teenagers in California's central valley spend one final night after their 1962 high school graduation cruising the strip with their buddies before they pursue their varying goals.,0,0,1,0,0,0,1,0,0,0,0
The staff of a Korean War field hospital use humor and high jinks to keep their sanity in the face of the horror of war.,0,0,1,0,0,0,1,0,0,0,0
A clerical mistake results in a bumbling Indian film star being invited to an exclusive Hollywood party instead of being fired.,0,0,1,0,0,0,0,0,0,0,0
Inspector Jacques Clouseau investigates the murder of Mr. Benjamin Ballon's driver at a country estate.,0,0,1,0,0,0,0,0,0,0,0
A couple find themselves in over their heads when they foster three children.,0,0,1,0,0,0,1,0,0,0,0
"Six tales of life and violence in the Old West, following a singing gunslinger, a bank robber, a traveling impresario, an elderly prospector, a wagon train, and a perverse pair of bounty hunters.",0,0,1,0,0,0,1,0,0,0,0
"Follows Stevie, a thirteen-year-old in 1990s-era Los Angeles who spends his summer navigating between his troubled home life and a group of new friends that he meets at a Motor Avenue skate shop.",0,0,1,0,0,0,1,0,0,0,0
"A quiet observation of the triumphs and defeats of daily life, along with the poetry evident in its smallest details.",0,0,1,0,0,0,1,0,1,0,0
"The story of a teenage boy, his mother, and two other women who help raise him among the love and freedom of Southern California of 1979.",0,0,1,0,0,0,1,0,0,0,0
A practical joking father tries to reconnect with his hard working daughter by creating an outrageous alter ego and posing as her CEO's life coach.,0,0,1,0,0,0,1,0,0,0,0
A retired orchestra conductor is on vacation with his daughter and his film director best friend in the Alps when he receives an invitation from Queen Elizabeth II to perform for Prince Philip's birthday.,0,0,1,0,0,0,1,0,0,0,0
Tamasha is about the journey of someone who has lost his edge in trying to follow acceptable conventions of society. The film is based on the central theme of abrasion and loss of self that... See full summary »,0,0,1,0,0,0,1,0,1,0,0
The Kadam family leaves India for France where they open a restaurant directly across the road from Madame Mallory's Michelin-starred eatery.,0,0,1,0,0,0,1,0,0,0,0
A man suffering a family loss enrolls in a class about care-giving that changes his perspective on life.,0,0,1,0,0,0,1,0,0,0,0
"A New York socialite, deeply troubled and in denial, arrives in San Francisco to impose upon her sister. She looks like a million dollars but isn't bringing money, peace, or love.",0,0,1,0,0,0,1,0,0,0,0
"High-school life gets even more unbearable for Nadine when her best friend, Krista, starts dating her older brother.",0,0,1,0,0,0,1,0,0,0,0
An unorthodox Irish policeman with a confrontational personality is partnered with an up-tight F.B.I. agent to investigate an international drug-smuggling ring.,0,0,1,1,0,0,0,0,0,1,0
"A father heads overseas to recover the body of his estranged son who died while traveling the ""El camino de Santiago,"" and decides to take the pilgrimage himself.",0,0,1,0,0,0,1,0,0,0,0
"15-year-old Oliver Tate has two objectives: To lose his virginity before his next birthday, and to extinguish the flame between his mother and an ex-lover who has resurfaced in her life.",0,0,1,0,0,0,1,0,1,0,0
A look at four seasons in the lives of a happily married couple and their relationships with their family and friends.,0,0,1,0,0,0,1,0,0,0,0
"The picaresque and touching story of the politically incorrect, fully lived life of the impulsive, irascible and fearlessly blunt Barney Panofsky.",0,0,1,0,0,0,1,0,0,0,0
Commander Logar fools Arif and sends him 1.000.000 years back in the time. He must civilize people from past to reach today.,0,1,1,0,0,0,0,0,0,0,0
"A band of rogue DJs that captivated Britain, playing the music that defined a generation and standing up to a government that wanted classical music, and nothing else, on the airwaves.",0,0,1,0,0,0,1,0,0,0,0
"The story of Alana Kane and Gary Valentine growing up, running around and going through the treacherous navigation of first love in the San Fernando Valley, 1973.",0,0,1,0,0,0,1,0,1,0,0
A land baron tries to reconnect with his two daughters after his wife is seriously injured in a boating accident.,0,0,1,0,0,0,1,0,0,0,0
A delusional young man strikes up an unconventional relationship with a doll he finds on the Internet.,0,0,1,0,0,0,1,0,1,0,0
Chaos ensues when a man tries to expose a dark secret regarding a recently deceased patriarch of a dysfunctional British family.,0,0,1,0,0,0,0,0,0,0,0
"Kazakh TV talking head Borat is dispatched to the United States to report on the greatest country in the world. With a documentary crew in tow, Borat becomes more interested in locating and marrying Pamela Anderson.",0,0,1,0,0,0,0,0,0,0,0
A calamity at Dante and Randal's shops sends them looking for new horizons - but they ultimately settle at the fast food empire Mooby's.,0,0,1,0,0,0,0,0,0,0,0
Follows two young boys dealing with their parents' divorce in Brooklyn in the 1980s.,0,0,1,0,0,0,1,0,0,0,0
A phobic con artist and his protégé are on the verge of pulling off a lucrative swindle when the former's teenage daughter arrives unexpectedly.,0,0,1,1,0,0,1,0,0,0,0
"A strait-laced French student moves into an apartment in Barcelona with a cast of six other characters from all over Europe. Together, they speak the international language of love and friendship.",0,0,1,0,0,0,1,0,1,0,0
Socially frustrated Barry Egan calls a phone-sex line to curb his loneliness. Little does he know it will land him in deep trouble and will jeopardize his burgeoning romance with the mysterious Lena.,0,0,1,0,0,0,1,0,1,0,0
"A stressed father, a bride-to-be with a secret, a smitten event planner, and relatives from around the world create much ado about the preparations for an arranged marriage in India.",0,0,1,0,0,0,1,0,1,0,0
"When a lottery winner dies of shock, his fellow townsfolk attempt to claim the money.",0,0,1,0,0,0,0,0,0,0,0
"With only the plan of moving in together after high school, two unusually devious friends seek direction in life. As a mere gag, they respond to a man's newspaper ad for a date, only to find it will greatly complicate their lives.",0,0,1,0,0,0,1,0,0,0,0
"A pretty, popular teenager can't go out on a date until her ill-tempered older sister does.",0,0,1,0,0,0,1,0,1,0,0
A high school teacher meets his match in an over-achieving student politician.,0,0,1,0,0,0,0,0,1,0,0
"Suffering from writer's block and eagerly awaiting his writing award, Harry Block remembers events from his past and scenes from his best-selling books as characters, real and fictional, come back to haunt him.",0,0,1,0,0,0,0,0,0,0,0
"When a sports agent has a moral epiphany and is fired for expressing it, he decides to put his new philosophy to the test as an independent agent with the only athlete who stays with him and his former colleague.",0,0,1,0,0,0,1,0,1,0,0
"After a woman leaves a briefcase at the airport terminal, a dumb limo driver and his dumber friend set out on a hilarious cross-country road trip to Aspen to return it.",0,0,1,0,0,0,0,0,0,0,0
"Young lovers Hero and Claudio, soon to wed, conspire to get verbal sparring partners and confirmed singles Benedick and Beatrice to wed as well.",0,0,1,0,0,0,1,0,1,0,0
A middle-aged couple suspects foul play when their neighbor's wife suddenly drops dead.,0,0,1,0,0,0,0,0,0,0,0
Two sisters join the first female professional baseball league and struggle to help it succeed amid their own growing rivalry.,0,0,1,0,0,0,1,0,0,0,0
"A young beautician, newly arrived in a small Louisiana town, finds work at the local salon, where a small group of women share a close bond of friendship, and welcome her into the fold.",0,0,1,0,0,0,1,0,1,0,0
A noble underachiever and a beautiful valedictorian fall in love the summer before she goes off to college.,0,0,1,0,0,0,1,0,1,0,0
An old Jewish woman and her African-American chauffeur in the American South have a relationship that grows and improves over the years.,0,0,1,0,0,0,1,0,1,0,0
"After wishing to be made big, a teenage boy wakes the next morning to find himself mysteriously in the body of an adult.",0,0,1,0,0,0,1,0,0,0,0
"When a childless couple of an ex-con and an ex-cop decide to help themselves to one of another family's quintuplets, their lives become more complicated than they anticipated.",0,0,1,1,0,0,0,0,0,0,0
"When two bumbling employees at a medical supply warehouse accidentally release a deadly gas into the air, the vapors cause the dead to rise again as zombies.",0,1,1,0,0,0,0,1,0,0,0
A young man inadvertently breaks three important rules concerning his new pet and unleashes a horde of malevolently mischievous monsters on a small town.,0,0,1,0,0,0,0,1,0,0,0
A failing ice hockey team finds success with outrageously violent hockey goonery.,0,0,1,0,0,0,1,0,0,0,0
"A schoolgirl and six of her classmates travel to her aunt's country home, which turns out to be haunted.",0,0,1,0,0,0,0,1,0,0,0
Five famous literary detective characters and their sidekicks are invited to a bizarre mansion to solve an even stranger mystery.,0,0,1,1,0,0,0,0,0,0,0
"A young, easy-going gunman worships and competes with an old gunfighter who only wants to retire.",0,0,1,0,1,0,0,0,0,0,0
"In 1850 Oregon, when a backwoodsman brings a wife home to his farm, his six brothers decide that they want to get married too.",0,0,1,0,0,0,1,0,0,0,0
"A love letter to journalists set in an outpost of an American newspaper in a fictional twentieth century French city that brings to life a collection of stories published in ""The French Dispatch Magazine"".",0,0,1,0,0,0,1,0,1,0,0
Jolly is a clumsy lawyer who is faced with representing the most critical court case of his career.,0,0,1,0,0,0,1,0,0,0,0
A prestigious Stockholm museum's chief art curator finds himself in times of both professional and personal crisis as he attempts to set up a controversial new exhibit.,0,0,1,0,0,0,1,0,0,0,0
"Moscow, 1953. After being in power for nearly 30 years, Soviet dictator Joseph Vissarionovich Stalin takes ill and quickly dies. Now the members of the Council of Ministers scramble for power.",0,0,1,0,0,0,1,0,0,0,0
"An acclaimed writer, his ex-wife, and their teenaged children come to terms with the complexities of love in all its forms over the course of one tumultuous year.",0,0,1,0,0,0,1,0,1,0,0
"A young boy whose parents have just divorced finds an unlikely friend and mentor in the misanthropic, bawdy, hedonistic war veteran who lives next door.",0,0,1,0,0,0,1,0,0,0,0
A family vacationing in the French Alps is confronted with a devastating avalanche.,0,0,1,0,0,0,1,0,0,0,0
"A novelist struggling with writer's block finds romance in a most unusual way: by creating a female character he thinks will love him, then willing her into existence.",0,0,1,0,0,0,1,0,0,0,0
"A depressed musician reunites with his lover. Though their romance, which has already endured several centuries, is disrupted by the arrival of her uncontrollable younger sister.",0,0,1,0,0,0,1,0,0,0,0
A young man is rocked by two announcements from his elderly father: that he has terminal cancer and that he has a young male lover.,0,0,1,0,0,0,1,0,1,0,0
"British retirees travel to India to take up residence in what they believe is a newly restored hotel. Less luxurious than advertised, the Marigold Hotel nevertheless slowly begins to charm in unexpected ways.",0,0,1,0,0,0,1,0,1,0,0
Four incompetent British terrorists set out to train for and commit an act of terror.,0,0,1,1,0,0,1,0,0,0,0
"A look at the lives of the strong-willed women of the Weston family, whose paths have diverged until a family crisis brings them back to the Oklahoma house they grew up in, and to the dysfunctional woman who raised them.",0,0,1,0,0,0,1,0,0,0,0
"A breathtaking, goose flesh igniting, awe inspiring love journey of an ordinary man Suri and his 'total opposite' love Taani.",0,0,1,0,0,0,1,0,0,0,0
Two low-level astronomers must go on a giant media tour to warn mankind of an approaching comet that will destroy planet Earth.,0,1,1,0,0,0,1,0,0,0,0
A film set in a strange afterlife way station that has been reserved for people who have committed suicide.,0,0,1,0,0,0,1,0,0,0,0
A lonely shoe salesman and an eccentric performance artist struggle to connect in this unique take on contemporary life.,0,0,1,0,0,0,1,0,0,0,0
"As the extremely withdrawn Don Johnston is dumped by his latest woman, he receives an anonymous letter from a former lover informing him that he has a son who may be looking for him. A freelance sleuth neighbor moves Don to embark on a cross-country search for his old flames in search of answers.",0,0,1,0,0,0,1,0,0,0,0
"Through the neighborhoods of Paris, love is veiled, revealed, imitated, sucked dry, reinvented, and awakened.",0,0,1,0,0,0,1,0,1,0,0
A man entranced by his dreams and imagination is love-struck with a French woman and feels he can show her his world.,0,0,1,0,0,0,1,0,0,0,0
"After being kicked out of his rock band, Dewey Finn becomes a substitute teacher of an uptight elementary private school, only to try and turn his class into a rock band.",0,0,1,0,0,0,0,0,0,0,0
Mockumentary captures the reunion of 1960s folk trio the Folksmen as they prepare for a show at The Town Hall to memorialize a recently deceased concert promoter.,0,0,1,0,0,0,0,0,0,0,0
