Movie_Description,Action,Sci-Fi,Comedy,Crime,Western,Family,Drama,Horror,Romance,Thriller,Adventure
"Casey Ryback hops on a Colorado to LA train to start a vacation with his niece. Early into the trip, terrorists board the train and use it as a mobile HQ to hijack a top secret destructive US satellite.",1,0,0,0,0,0,0,0,0,1,1
"In a dystopian future, Joseph Dredd, the most famous Judge (a police officer with instant field judiciary powers), is convicted for a crime he did not commit and must face his murderous counterpart.",1,1,0,1,0,0,0,0,0,0,0
A woman entices a bomb expert she's involved with into destroying the mafia that killed her family.,1,0,0,0,0,0,1,0,0,1,0
"Axel Foley, while investigating a car theft ring, comes across something much bigger than that: the same men who killed his boss are running a counterfeit money ring out of a theme park in Los Angeles.",1,0,1,1,0,0,0,0,0,0,0
Captain Kirk and his crew must deal with Mr. Spock's long-lost half-brother who hijacks the Enterprise for an obsessive search for God at the center of the galaxy.,1,0,0,0,0,0,0,0,0,0,1
A former FBI agent turned small-town sheriff agrees to help the FBI chief infiltrate the Chicago mafia when the FBI chief's son is killed by them.,1,0,0,1,0,0,0,0,0,1,0
"In the near future, convicts are offered the chance to volunteer as medical subjects to shorten their sentence. One such subject for a new drug capable of generating feelings of love begins questioning the reality of his emotions.",1,0,0,1,0,0,1,0,0,0,0
"Ava is a deadly assassin who works for a black ops organization, traveling the globe specializing in high profile hits. When a job goes dangerously wrong she is forced to fight for her own survival.",1,0,0,0,0,0,1,0,0,1,0
"Diana must contend with a work colleague and businessman, whose desire for extreme wealth sends the world down a path of destruction, after an ancient artifact that grants wishes goes missing.",1,0,0,0,0,0,0,0,0,0,1
A man discovers that his hallucinations are actually visions from past lives.,1,1,0,0,0,0,0,0,0,1,0
Three friends are on the verge of getting their video game financed when their benefactor is taken hostage by terrorists.,1,0,1,0,0,0,0,0,0,0,0
A furloughed convict and his American and Chinese partners hunt a high-level cybercrime network from Chicago to Los Angeles to Hong Kong to Jakarta.,1,0,0,1,0,0,0,0,0,1,0
"Mortal hero Bek teams with the god Horus in an alliance against Set, the merciless god of darkness, who has usurped Egypt's throne, plunging the once peaceful and prosperous empire into chaos and conflict.",1,0,0,0,0,0,0,0,0,0,1
A young teenager camping in the woods helps rescue the President of the United States when Air Force One is shot down near his campsite.,1,0,0,0,0,0,0,0,0,0,1
"Rose Hathaway is a Dhampir, half human-half vampire, a guardian of the Moroi, peaceful, mortal vampires living discreetly within our world. Her calling is to protect the Moroi from bloodthirsty, immortal Vampires, the Strigoi.",1,0,1,0,0,0,1,0,0,0,0
A vengeful father escapes from hell and chases after the men who killed his daughter and kidnapped his granddaughter.,1,0,0,0,0,0,0,0,0,1,0
"Two veterans of the Bosnian War, one American, one Serbian, find their unlikely friendship tested when one of them reveals their true intentions.",1,0,0,0,0,0,1,0,0,1,0
"When the puppet cast of a '90s children's TV show begin to get murdered one by one, a disgraced LAPD detective-turned-private eye puppet takes on the case.",1,0,1,1,0,0,0,0,0,0,0
"Former C.I.A. spy Bob Ho takes on his toughest assignment to date: looking after his girlfriend's three kids, who haven't exactly warmed to their mom's beau.",1,0,1,0,0,1,0,0,0,0,0
"On the hunt for a fabled treasure of gold, a band of warriors, assassins, and a rogue British soldier descend upon a village in feudal China, where a humble blacksmith looks to defend himself and his fellow villagers.",1,0,0,0,0,0,0,0,0,0,0
"A vacationing woman meets her ideal man, leading to a swift marriage. Back at home, however, their idyllic life is upset when they discover their neighbors could be assassins who have been contracted to kill the couple.",1,0,1,0,0,0,0,0,1,0,0
"In the near future, a drone pilot sent into a war zone finds himself paired with a top-secret android officer on a mission to stop a nuclear attack.",1,0,0,0,0,0,0,0,0,0,1
All the rules are broken as a sect of lawless marauders decides that the annual Purge does not stop at daybreak and instead should never end.,1,0,0,0,0,0,0,1,0,1,0
"14th-century knights transport a suspected witch to a monastery, where monks deduce that her powers could be the source of the Black Plague.",1,0,0,0,0,0,0,0,0,0,1
"As the Roman empire crumbles, young Romulus Augustus flees the city and embarks on a perilous voyage to Britain to track down a legion of supporters.",1,0,0,0,0,0,0,0,0,0,1
"A Viking boy is left behind after his clan battles a Native American tribe. Raised within the tribe, he ultimately becomes their savior in a fight against the Norsemen.",1,0,0,0,0,0,1,0,0,0,1
"Æon Flux is a mysterious assassin working for the Monicans, a group of rebels trying to overthrow the government. When she is sent on a mission to kill the Chairman, a whole new mystery is found.",1,1,0,0,0,0,0,0,0,0,1
A professional athlete has to help a U.S. government agent recover a missing jet.,1,0,1,0,0,0,0,0,0,0,1
A hapless chauffeur must take a comatose Secret Agent's place using his special gadget-laden tuxedo.,1,1,1,0,0,0,0,0,0,0,0
"Based on the very underground comic book of the same name, a Tibetan monk becomes a mentor to a young street punk and tries teaching him how to protect the scroll of ultimate power from a secret Nazi organization bent on world domination.",1,0,1,0,0,0,0,0,0,0,0
French nuclear tests irradiate an iguana into a giant monster that heads off to New York City. The American military must chase the monster across the city to stop it before it reproduces.,1,1,0,0,0,0,0,0,0,1,0
"The unruly team of hockey misfits grows up a bit and receives scholarships to a prestigious prep school, where they take on the snotty varsity team.",1,0,1,0,0,0,1,0,0,0,0
"Batman must battle former district attorney Harvey Dent, who is now Two-Face and Edward Nygma, The Riddler with help from an amorous psychologist and a young circus acrobat who becomes his sidekick, Robin.",1,0,0,0,0,0,0,0,0,0,1
A group of people try to survive when machines start to come alive and become homicidal.,1,0,1,0,0,0,0,1,0,0,0
"Ten years after a worldwide series of ape revolutions and a brutal nuclear war among humans, Caesar must protect survivors of both species from an insidious human cult and a militant ape faction alike.",1,1,0,0,0,0,0,0,0,0,0
A G.I. Joe spin-off centered around the character of Snake Eyes.,1,0,0,1,0,0,0,0,0,0,1
"Five young mutants, just discovering their abilities while held in a secret facility against their will, fight to escape their past sins and save themselves.",1,0,0,0,0,0,0,1,0,0,0
"When a young boy accidentally triggers the universe's most lethal hunters' return to Earth, only a ragtag crew of ex-soldiers and a disgruntled scientist can prevent the end of the human race.",1,1,0,0,0,0,0,0,0,0,1
"An adrenaline junkie walks away from a whirlwind romance and embraces a new life as a thief, though he soon finds himself pursued by veteran police officer and engaged in a turf war with a local gangster.",1,0,1,1,0,0,0,0,0,0,0
"When the network of satellites designed to control the global climate starts to attack Earth, it's a race against the clock for its creator to uncover the real threat before a worldwide Geostorm wipes out everything and everyone.",1,1,0,0,0,0,0,0,0,1,0
Alice fights alongside a resistance movement to regain her freedom from an Umbrella Corporation testing facility.,1,1,0,0,0,0,0,1,0,0,0
"When Sahir, a circus entertainer trained in magic and acrobatics, turns into a thief to take down a corrupt bank in Chicago that ruined his father, Indian officers Jai and Ali are called to catch him.",1,0,0,1,0,0,1,0,0,0,0
A young woman discovers her destiny as an heiress of intergalactic nobility and must fight to protect the inhabitants of Earth from an ancient and destructive industry.,1,1,0,0,0,0,0,0,0,0,1
"Unemployed and newly-divorced Stephanie Plum lands a job at her cousin's bail-bond business, where her first assignment puts her on the trail of a wanted local cop from her romantic past.",1,0,1,1,0,0,0,0,0,0,0
"Forced underground by the next ice age, a struggling outpost of survivors must fight to preserve humanity against a threat even more savage than nature.",1,1,0,0,0,0,0,0,0,1,0
"While spending years attempting to return home, marooned Space Ranger Buzz Lightyear encounters an army of ruthless robots commanded by Zurg who are attempting to steal his fuel source.",1,0,0,0,0,0,0,0,0,0,1
A hitman who's in Bangkok to pull off a series of jobs violates his personal code when he falls for a local woman and bonds with his errand boy.,1,0,0,1,0,0,0,0,0,1,0
"Coming together to solve a series of murders in New York City are a police detective and an assassin, who will be hunted by the police, the mob, and a ruthless corporation.",1,0,0,1,0,0,0,0,0,0,1
"A space-time vortex sucks scientist Rick Marshall, his assistant Holly and a survivalist Will into a world populated by dinosaurs and painfully slow creatures called Sleestaks.",1,0,1,0,0,0,0,0,0,0,1
Two LAPD detectives who moonlight in other fields investigate the murder of an up-and-coming rap group.,1,0,1,1,0,0,0,0,0,0,0
A man blinded by toxic waste which also enhanced his remaining senses fights crime as an acrobatic martial arts superhero.,1,0,0,1,0,0,0,0,0,0,0
"Dick Steele, Agent WD-40 is assigned by his Director, to stop the evil General Rancor from destroying the world. WD-40 believed Rancor was dead and he teams up with the hot KGB Agent Veronique Ukrinsky to find Rancor and save the world.",1,0,1,0,0,0,0,0,0,0,0
"A girl is among the few survivors of a dystopian Earth. Riding a war tank, she fights against the tyranny of a mega-corporation that dominates the remaining potable water supply of the planet.",1,1,1,0,0,0,0,0,0,0,0
The heroic warrior He-Man battles against the evil lord Skeletor and his armies of darkness for control of Castle Grayskull.,1,0,0,0,0,0,0,0,0,0,1
"Set in 1998, this origin story explores the secrets of the mysterious Spencer Mansion and the ill-fated Raccoon City.",1,1,0,0,0,0,0,1,0,0,0
"When Cpt. Artemis and her loyal soldiers are transported to a new world, they engage in a desperate battle for survival against enormous enemies with incredible powers. Feature film based on the video game by Capcom.",1,0,0,0,0,0,0,0,0,0,1
"America's third political party, the New Founding Fathers of America, comes to power and conducts an experiment: no laws for 12 hours on Staten Island. No one has to stay on the island, but $5,000 is given to anyone who does.",1,1,0,0,0,0,0,1,0,0,0
A mysterious force knocks the moon from its orbit and sends it hurtling on a collision course toward earth.,1,1,0,0,0,0,0,0,0,0,1
Dom and the crew must take on an international terrorist who turns out to be Dom and Mia's estranged brother.,1,0,0,1,0,0,0,0,0,1,0
"Biochemist Michael Morbius tries to cure himself of a rare blood disease, but he inadvertently infects himself with a form of vampirism instead.",1,0,0,0,0,0,0,1,0,0,1
"In a desert dystopia, a young woman is kidnapped by cannibals.",1,0,0,0,0,0,0,1,0,0,0
"A deadly threat from Earth's history reappears and a hunt for a lost artifact takes place between Autobots and Decepticons, while Optimus Prime encounters his creator in space.",1,1,0,0,0,0,0,0,0,0,1
"Four waves of increasingly deadly alien attacks have left most of Earth in ruin. Cassie is on the run, desperately trying to save her younger brother.",1,1,0,0,0,0,0,0,0,0,1
"Two decades after the first Independence Day invasion, Earth is faced with a new extra-Solar threat. But will mankind's new space defenses be enough?",1,1,0,0,0,0,0,0,0,0,1
"John McClane travels to Russia to help out his seemingly wayward son, Jack, only to discover that Jack is a CIA operative working undercover, causing the father and son to team up against underworld forces.",1,0,0,0,0,0,0,0,0,1,0
"Xander Cage is left for dead after an incident, though he secretly returns to action for a new, tough assignment with his handler Augustus Gibbons.",1,0,0,0,0,0,0,0,0,1,1
"Terrorists kidnap the Russian Prime Minister's 2 kids, take Chernobyl nuclear power plant and threaten to blow up a reactor. 4 Universal Soldiers go in but are no match to a Next Gen. UniSol Luc (Jean-Claude Van Damme) goes in but faces 2 NGUs.",1,1,0,0,0,0,0,0,0,0,1
"When a shopping mall is taken over by a gang of organized crooks, it's up to a mild-mannered security guard to save the day.",1,0,1,1,0,0,0,0,0,0,0
"When a group of strangers at a dusty roadside diner come under attack by demonic forces, their only chance for survival lies with an archangel named Michael, who informs a pregnant waitress that her unborn child is humanity's last hope.",1,0,0,0,0,0,0,1,0,0,0
"In the Far East, Alex O'Connell, the son of famed mummy fighters Rick and Evy O'Connell, unearths the mummy of the first Emperor of Qin -- a shape-shifting entity cursed by a witch centuries ago.",1,0,0,0,0,0,0,1,0,0,0
28th century soldier Mitch Hunter leads a fight against an army of underworld Mutants.,1,0,0,0,0,0,0,0,0,0,1
Space Marines are sent to investigate strange events at a research facility on Mars but find themselves at the mercy of genetically enhanced killing machines.,1,1,0,0,0,0,0,1,0,0,0
A Hong Kong detective suffers a fatal accident involving a mysterious medallion and is transformed into an immortal warrior with superhuman powers.,1,0,1,0,0,0,0,0,0,0,0
"The Cortez siblings set out for a mysterious island, where they encounter a genetic scientist and a set of rival spy kids.",1,0,1,0,0,0,0,0,0,0,1
"When motorcycle rider Johnny Blaze sells his soul to the Devil to save his father's life, he is transformed into the Ghost Rider, the Devil's own bounty hunter, and is sent to hunt down sinners.",1,0,0,0,0,0,0,0,0,1,0
"In order to protect a beautiful woman and her son from a robber, a male FBI agent disguises himself as a large grandmother.",1,0,1,1,0,0,0,0,0,0,0
The Robinson family was going into space to fight for a chance for humanity. Now they are fighting to live long enough to find a way home.,1,0,0,0,0,1,0,0,0,0,1
"An elite mercenary is killed, but comes back from Hell as a reluctant soldier of the Devil.",1,0,0,0,0,0,1,1,0,0,0
"A giant egg is unearthed at a construction site and soon opened, releasing the terrible Ivan Ooze, who wreaks vengeance on Zordon for imprisoning him millennia ago. With Zordon dying and their powers lost, the Rangers head to a distant planet to find the mystic warrior Dulcea.",1,0,0,0,0,1,0,0,0,0,1
"When an expedition to the African Congo ends in disaster, a new team is assembled to find out what went wrong.",1,0,0,0,0,0,0,0,0,0,1
"Ostracised villain John Kreese attempts to gain revenge on Daniel and Miyagi, with the help of a Vietnam War comrade, the wealthy owner of a toxic waste disposal business.",1,0,0,0,0,1,1,0,0,0,0
An uptight and by-the-book cop (Reese Witherspoon) tries to protect the outgoing widow (Sofia Vergara) of a drug boss as they race through Texas pursued by crooked cops and murderous gunmen.,1,0,1,1,0,0,0,0,0,0,0
"In the south of France, former special-ops mercenary Frank Martin enters into a game of chess with a femme-fatale and her three sidekicks who are looking for revenge against a sinister Russian kingpin.",1,0,0,0,0,0,0,0,0,1,0
A homicide detective is pushed to the brink of his moral and physical limits as he tangles with a ferociously skilled hired killer who specializes in torture and pain.,1,0,0,1,0,0,0,0,0,0,0
A young man sets out to uncover the truth about his life after finding his baby photo on a missing persons website.,1,0,0,0,0,0,0,0,0,1,0
"Frankenstein's creature finds himself caught in an all-out, centuries-old war between two immortal clans.",1,1,0,0,0,0,0,0,0,0,0
"Four young men who belong to a New England supernatural legacy are forced to battle a fifth power long thought to have died out. Meanwhile, jealousy and suspicion threaten to tear them apart.",1,0,0,0,0,0,0,0,0,0,1
"In his homeland of Alagaesia, a farm boy happens upon a dragon's egg -- a discovery that leads him on a predestined journey where he realizes he's the one person who can defend his home against an evil king.",1,0,0,0,0,1,0,0,0,0,1
"In the prehistoric past, D'Leh is a mammoth hunter who bonds with the beautiful Evolet. When warriors on horseback capture Evolet and the tribesmen, D'Leh must embark on an odyssey to save his true love.",1,0,0,0,0,0,1,0,0,0,1
A specially trained squad of guinea pigs is dispatched to stop a diabolical billionaire from taking over the world.,1,0,0,0,0,0,0,0,0,0,1
"After Heather Burns (Cheryl Frasier) and Stan Fields (William Shatner) are kidnapped, Gracie Hart (Sandra Bullock) goes undercover in Las Vegas, Nevada to find them.",1,0,1,1,0,0,0,0,0,0,0
A government agent trains Cody Banks in the ways of covert operations that require younger participants.,1,0,1,0,0,0,0,0,0,0,1
"A look at the top-secret, high-tech espionage war going on between cats and dogs, of which their human owners are blissfully unaware.",1,0,1,0,0,0,0,0,0,0,1
The fearless warrior Red Sonja sets out to avenge her family's murder and rid her kingdom from the tyrannical rule of evil Queen Gedren.,1,0,0,0,0,0,0,0,0,0,1
"In the midst of an apocalypse, a man struggles to reach his pregnant wife, who is thousands of miles away.",1,0,0,0,0,0,1,0,0,0,0
"The siblings of two estranged lovers fall for each other, unaware of the violent past that drove them apart.",1,0,1,0,0,0,1,0,0,0,0
"As a string of mysterious killings grips Seattle, Bella, whose high school graduation is fast approaching, is forced to choose between her love for vampire Edward and her friendship with werewolf Jacob.",1,0,0,0,0,0,1,0,0,0,1
"A group of delinquents are sent to clean the Blackwell Hotel. Little do they know reclusive psychopath Jacob Goodnight has holed away in the rotting hotel. When one of the teens is captured, those who remain - a group that includes the cop who put a bullet in Goodnight's head four years ago - band together to survive against the brutal killer.",1,0,0,0,0,0,0,1,0,1,0
"Deeply ensconced in a top-secret military program, three pilots struggle to bring an artificial intelligence program under control before it initiates the next world war.",1,1,0,0,0,0,0,0,0,0,1
"After outrunning a typhoon at sea, a strong-willed tugboat navigator and her crew discover a high-tech alien life form that's taken control of a Russian research vessel and aims to destroy on a massive scale.",1,1,0,0,0,0,0,1,0,0,0
"The Phantom, descendent of a line of African superheroes, travels to New York City to thwart a wealthy criminal genius from obtaining three magic skulls which would give him the secret to ultimate power.",1,0,1,0,0,0,0,0,0,0,1
A martial artist hunts a killer in a plague-infested urban dump of the future.,1,1,0,0,0,0,0,0,0,1,0
Synthetic kryptonite laced with tar splits Superman in two: good Clark Kent and bad Man of Steel.,1,0,1,0,0,0,0,0,0,0,1
A female WWII pilot traveling with top secret documents on a B-17 Flying Fortress encounters an evil presence on board the flight.,1,0,0,0,0,0,0,1,0,0,0
A gang of amateur dancers takes part in a dancing competition to avenge their personal vendetta.,1,0,1,1,0,0,0,0,0,0,0
"After his family is kidnapped during their sailing trip in Spain, a young Wall Street trader is confronted by the people responsible: intelligence agents looking to recover a mysterious briefcase.",1,0,0,0,0,0,0,0,0,1,0
"In Moscow, five young people lead the charge against an alien race who have attacked Earth via our power supply.",1,0,0,0,0,0,0,1,0,0,1
The Angels investigate a series of murders which occur after the theft of a witness protection profile database.,1,0,1,0,0,0,0,0,0,0,1
"In 2176, a Martian police unit is sent to pick up a highly dangerous criminal at a remote mining post. Upon arrival, the cops find that the post has become a charnel house.",1,1,0,0,0,0,0,1,0,0,0
"A group of thieves breaks into a chamber expecting to find paintings, but instead they release the count himself, who travels to New Orleans to find his nemesis' daughter, Mary Van Helsing.",1,0,0,0,0,0,0,1,0,0,0
"The two best special agents in the Wild West must save President Grant from the clutches of a diabolical, wheelchair-bound, steampunk-savvy, Confederate scientist bent on revenge for losing the Civil War.",1,1,1,0,0,0,0,0,0,0,0
"Elwood must reunite the old band, with a few new members, and go on another ""Mission from God.""",1,0,1,1,0,0,0,0,0,0,0
"An outlaw who was raised by Native Americans discovers that he has five half-brothers. Together the men go on a mission to find their wayward, deadbeat dad.",1,0,1,0,0,0,0,0,0,0,1
"A crash landing leaves Kitai Raige and his father Cypher stranded on Earth, a millennium after events forced humanity's escape. With Cypher injured, Kitai must embark on a perilous journey to signal for help.",1,1,0,0,0,0,0,0,0,0,1
Jin Kazama witnesses the death of his mother Jun by Tekken in the slums known as Anvil. After finding a Tekken ID he decides to seek out vengeance for his mother's death.,1,0,0,1,0,0,1,0,0,0,0
"The world's best fighters are invited to DOA, an invitational martial arts contest. There, four female rival fighters will have to work together to uncover the secret that the organizer of the tournament is trying to hide.",1,0,0,0,0,0,0,0,0,0,1
"A couple agree to have their deceased son cloned, under the supervision of an enigmatic doctor, but bizarre things start to happen several years after his rebirth.",1,0,0,0,0,0,1,0,0,0,0
An international spy teams up with an arms dealer to escape from a penal colony and rescue his family from a terrorist.,1,1,1,0,0,0,0,0,0,0,0
"A ""National Geographic"" film crew is taken hostage by an insane hunter, who forces them along on his quest to capture the world's largest - and deadliest - snake.",1,0,0,0,0,0,0,1,0,0,1
"At the cusp of India's birth as an Independent nation, a family makes an arduous journey to freedom at a cost. A young boy Bharat, makes a promise to his Father that he will keep his family together no matter what.",1,0,1,0,0,0,1,0,0,0,0
"Derek and Hansel are lured into modelling again, in Rome, where they find themselves the target of a sinister conspiracy.",1,0,1,0,0,0,0,0,0,0,1
"The U.S. military makes a scarred bounty hunter with warrants on his own head an offer he cannot refuse: in exchange for his freedom, he must stop a terrorist who is ready to unleash Hell on Earth.",1,0,0,0,0,0,1,0,0,0,0
"Rookie cop Denny Colt returns from the beyond as The Spirit, a hero whose mission is to fight against the bad forces in Central City.",1,0,0,1,0,0,0,0,0,0,0
A group of diamond thieves on the run kidnap the wife of a recently discharged marine who goes on a chase through the South Carolinian wilderness to retrieve her.,1,0,1,0,0,0,1,0,0,0,0
"A scientific expedition sets out for Borneo to seek a flower called the Blood Orchid, which could grant longer life. Meanwhile, they run afoul of snakes and each other.",1,0,0,0,0,0,0,1,0,0,1
"Elektra the warrior survives a near-death experience, becomes an assassin-for-hire, and tries to protect her two latest targets, a single father and his young daughter, from a group of supernatural assassins.",1,0,0,1,0,0,0,0,0,0,1
"When their closest friend April O'Neil discovers an ancient scepter with magical powers, the turtles must cow-a-bunga their way back to 17th century Japan to rescue her from the evil clutches of Lord Norinaga.",1,0,1,0,0,0,0,0,0,0,1
A sarcastic humanoid duck is pulled from his homeworld to Earth where he must stop an alien invasion with the help of a nerdy scientist and a struggling female rock singer.,1,0,1,0,0,0,0,0,0,0,1
"When her boyfriend dumps her before their exotic vacation, a young woman persuades her ultra-cautious mother to travel with her to paradise, with unexpected results.",1,0,1,0,0,0,0,0,0,0,1
The daughter of a wealthy nobleman secretly falls in love with her bodyguard.,1,0,1,0,0,0,1,0,0,0,0
"When the titular antagonist of an action game takes on physical form, it's only the game's less powerful protagonist who can save his creator's family.",1,1,0,0,0,0,0,0,0,0,1
"Warring Alien and Predator races descend on a rural Colorado town, where unsuspecting residents must band together for any chance of survival.",1,0,0,0,0,0,0,1,0,0,1
"Orphaned high school student Rick Riker is bitten by a radioactive dragonfly, develops super powers (except for the ability to fly), and becomes a hero.",1,1,1,0,0,0,0,0,0,0,0
A young hot shot driver is in the middle of a championship season and is coming apart at the seams. A former CART champion is called in to give him guidance.,1,0,0,0,0,0,1,0,0,0,0
"Strange lights descend on the city of Los Angeles, drawing people outside like moths to a flame where an extraterrestrial force threatens to swallow the entire human population off the face of the Earth.",1,1,0,0,0,0,0,0,0,1,0
"Alex Pruitt, an 8-year-old boy living in Chicago, must fend off international spies who seek a top-secret computer chip in his toy car.",1,0,1,1,0,0,0,0,0,0,0
Mr. Miyagi is back and he takes a new pupil under his wing: a troubled adolescent girl.,1,0,0,0,0,1,1,0,0,0,0
"After six years of keeping our malls safe, Paul Blart has earned a well-deserved vacation. He heads to Las Vegas with his teenage daughter before she heads off to college. But safety never takes a holiday and when duty calls, Blart answers.",1,0,1,1,0,0,0,0,0,0,0
Malcolm Turner and his stepson Trent go undercover at an all-girls school to flush out a killer.,1,0,1,1,0,0,0,0,0,0,0
