Movie_Description,Action,Sci-Fi,Comedy,Crime,Western,Family,Drama,Horror,Romance,Thriller,Adventure
A young woman's world unravels when a drug prescribed by her psychiatrist has unexpected side effects.,0,0,0,1,0,0,1,0,0,0,0
An expert cutter must outwit a dangerous group of mobsters in order to survive a fateful night.,0,0,0,1,0,0,1,0,0,0,0
A woman is released from prison after serving a sentence for a violent crime and re-enters a society that refuses to forgive her past.,0,0,0,1,0,0,1,0,0,0,0
"Two people live in different times. Seo-Yeon lives in the present and Young-Sook lives in the past. One phone call connects the two, and their lives are changed irrevocably.",0,0,0,1,0,0,0,1,0,0,0
"A mom looks for another source of income, when her husband leaves with the money meant for the new mobile home. A nearby Indian territory stretches across the border to Canada with a drivable frozen river between. Smuggling?",0,0,0,1,0,0,1,0,0,0,0
"When a congressional aide is killed, a Washington, D.C. journalist starts investigating the case involving the Representative, his old college friend.",0,0,0,1,0,0,1,0,0,0,0
Several ordinary high school students go through their daily routine as two others prepare for something more malevolent.,0,0,0,1,0,0,1,0,0,1,0
A juror on the inside and a woman on the outside manipulate a court trial involving a major gun manufacturer.,0,0,0,1,0,0,1,0,0,1,0
When the trail goes cold on a murder investigation of a policeman an undercover narcotics officer is lured back to the force to help solve the case.,0,0,0,1,0,0,1,0,0,0,0
"Publicist Stuart Shepard finds himself trapped in a phone booth, pinned down by an extortionist's sniper rifle. Unable to leave or receive outside help, Stuart's negotiation with the caller leads to a jaw-dropping climax.",0,0,0,1,0,0,0,0,0,1,0
A former cop turned street-hustler accidentally uncovers a conspiracy in Los Angeles in 1999.,0,1,0,1,0,0,1,0,0,0,0
"After a young woman suffers a brutal gang rape in a bar one night, a prosecutor assists in bringing the perpetrators to justice, including the ones who encouraged and cheered on the attack.",0,0,0,1,0,0,1,0,0,0,0
"Absent-minded street thug Rusty James struggles to live up to his legendary older brother's reputation, and longs for the days of gang warfare.",0,0,0,1,0,0,1,0,1,0,0
"The rivalry between two gangs, the poor Greasers and the rich Socs, only heats up when one gang member kills a member of the other.",0,0,0,1,0,0,1,0,0,0,0
"A mysterious blonde woman kills one of a psychiatrist's patients, and then goes after the high-class call girl who witnessed the murder.",0,0,0,1,0,0,1,0,0,0,0
A small-town detective searching for a missing man has only one lead: a connection with a New York prostitute.,0,0,0,1,0,0,0,0,0,1,0
"Mark marries Marnie although she is a habitual thief and has serious psychological problems, and tries to help her confront and resolve them.",0,0,0,1,0,0,1,0,0,0,0
A ninety-year-old horticulturist and Korean War veteran turns drug mule for a Mexican cartel.,0,0,0,1,0,0,1,0,0,1,0
A grifter working his way up from low-ranking carnival worker to lauded psychic medium matches wits with a psychiatrist bent on exposing him.,0,0,0,1,0,0,1,0,0,1,0
A customs officer who can smell fear develops an unusual attraction to a strange traveler while aiding a police investigation which will call into question her entire existence.,0,0,0,1,0,0,1,0,0,0,0
"A naval officer returns home to find out about his wife's affair. Soon, he surrenders after murdering the lover but as the case unfolds, it starts to reveal his hidden intention.",0,0,0,1,0,0,1,0,0,1,0
A punk rock band is forced to fight for survival after witnessing a murder at a neo-Nazi skinhead bar.,0,0,0,1,0,0,1,1,0,0,0
"Bob Saginowski finds himself at the center of a robbery gone awry and entwined in an investigation that digs deep into the neighborhood's past where friends, families, and foes all work together to make a living - no matter the cost.",0,0,0,1,0,0,1,0,0,1,0
"Scampia Vele is the corbusian architecture which has become a stronghold for Mafia of Naples, Italy.",0,0,0,1,0,0,1,0,0,0,0
A psychological thriller centered around a black-ops interrogator and an F.B.I. Agent who press a suspect terrorist into divulging the location of three nuclear weapons set to detonate in the U.S.,0,0,0,1,0,0,1,0,0,1,0
"Chris is a once promising high school athlete whose life is turned upside down following a tragic accident. As he tries to maintain a normal life, he takes a job as a janitor at a bank, where he ultimately finds himself caught up in a planned heist.",0,0,0,1,0,0,1,0,0,1,0
John Quincy Archibald takes a hospital emergency room hostage when his insurance won't cover his son's heart transplant.,0,0,0,1,0,0,1,0,0,1,0
"A woman takes the law into her own hands after police ignore her pleas to arrest the man responsible for her husband's death, and finds herself not only under arrest for murder but falling in love with an officer.",0,0,0,1,0,0,1,0,1,0,0
"After a tragic incident, a man drifts into a world populated by thugs and speed junkies.",0,0,0,1,0,0,1,0,0,0,0
"A college dropout, attempting to live up to his father's high standards, gets a job as a broker for a suburban investment firm which puts him on the fast track to success. But the job might not be as legitimate as it first appeared to be.",0,0,0,1,0,0,1,0,0,1,0
"The Sheriff of a suburban New Jersey community, populated by New York City police officers, slowly discovers the town is a front for mob connections and corruption.",0,0,0,1,0,0,1,0,0,1,0
A man searches for his missing wife after his car breaks down in the middle of the desert.,0,0,0,1,0,0,1,0,0,0,0
"While investigating a young nun's rape, a corrupt New York City police detective, with a serious drug and gambling addiction, tries to change his ways and find forgiveness and redemption.",0,0,0,1,0,0,1,0,0,1,0
A nightmarish futuristic fantasy about the controlling power of big corporations and an innocent cop who stumbles on the truth.,0,1,0,1,0,0,0,0,0,0,0
"Eli and Charlie Sisters, an infamous duo of gunslinging assassins, chase a gold prospector and his unexpected ally in 1850s Oregon.",0,0,0,1,1,0,1,0,0,0,0
"Laura, a Spanish woman living in Buenos Aires, returns to her hometown outside Madrid with her two children to attend her sister's wedding. However, the trip is upset by unexpected events that bring secrets into the open.",0,0,0,1,0,0,1,0,0,0,0
An art auctioneer becomes mixed up with a group of criminals partners with a hypnotherapist in order to recover a lost painting.,0,0,0,1,0,0,1,0,0,0,0
A teenage girl is targeted by an online sexual predator.,0,0,0,1,0,0,1,0,0,1,0
"Under investigation as a suspect in her husband's murder, a wife reveals details of their thorny marriage that seem to only further blur the truth.",0,0,0,1,0,0,1,0,0,0,0
"Mary Surratt is the lone female charged as a co-conspirator in the assassination trial of Abraham Lincoln. As the whole nation turns against her, she is forced to rely on her reluctant lawyer to uncover the truth and save her life.",0,0,0,1,0,0,1,0,0,0,0
"Danny Ocean rounds up the boys for a third heist after casino owner Willy Bank double-crosses one of the original eleven, Reuben Tishkoff.",0,0,0,1,0,0,0,0,0,1,0
"The movie is a coming-of-age drama about a boy growing up in Astoria, New York during the 1980s. As his friends end up dead, on drugs, or in prison. He comes to believe he has been saved from their fates by various so-called saints.",0,0,0,1,0,0,1,0,0,0,0
A murder detective must follow the footsteps of a brutal killer within the secrets of a classist college.,0,0,0,1,0,0,0,0,0,1,0
An extremely volatile and dangerous Englishman goes to Los Angeles to find the man he considers responsible for his daughter's death.,0,0,0,1,0,0,1,0,0,0,0
A drug kingpin is released from prison and seeks to take total control of the criminal underworld in order to give back to the community.,0,0,0,1,0,0,0,0,0,1,0
"A small-time conman has torn loyalties between his estranged mother and new girlfriend, both of whom are high-stakes grifters with their own angles to play.",0,0,0,1,0,0,1,0,0,1,0
"In a hotel room in Paris, a doctor comes out of the shower and finds that his wife has disappeared. He soon finds himself caught up in a world of intrigue, espionage, gangsters, drugs and murder.",0,0,0,1,0,0,1,0,0,0,0
"A debonair, adventuresome bank executive believes he has pulled off the perfect multi-million dollar heist, only to match wits with a sexy insurance investigator who will do anything to get her man.",0,0,0,1,0,0,1,0,1,0,0
"A three-part story of Norway's worst terrorist attack in which over seventy people were killed. 22 July looks at the disaster itself, the survivors, Norway's political system and the lawyers who worked on this horrific case.",0,0,0,1,0,0,1,0,0,0,0
Strange occurrences plague a small town detective and his family as he investigates the disappearance of a young boy.,0,0,0,1,0,0,1,1,0,0,0
"Based on the real-life prison break of two political captives, Escape From Pretoria is a race-against-time thriller set in the tumultuous apartheid days of South Africa.",0,0,0,1,0,0,0,0,0,1,0
"A traumatized veteran unafraid of violence tracks down missing girls for a living. When a job spins out of control, Joe's nightmares overtake him as a conspiracy is uncovered leading to what could be his death trip or his awakening.",0,0,0,1,0,0,1,0,0,0,0
Four women with nothing in common except a debt left behind by their dead husbands' criminal activities take fate into their own hands and conspire to forge a future on their own terms.,0,0,0,1,0,0,1,0,0,1,0
"The story follows Jack, a highly intelligent serial killer, over the course of twelve years, and depicts the murders that really develop his inner madman.",0,0,0,1,0,0,1,1,0,0,0
"An ex-con, who is the unlikeliest of role models, meets a 15-year-old boy and is faced with the choice of redemption or ruin.",0,0,0,1,0,0,1,0,0,0,0
"A Chechen Muslim illegally immigrates to Hamburg, where he gets caught in the international war on terror.",0,0,0,1,0,0,1,0,0,1,0
An operative for an elite private intelligence firm finds her priorities changing dramatically after she is tasked with infiltrating an anarchist group known for executing covert attacks upon major corporations.,0,0,0,1,0,0,1,0,0,1,0
A teen living under house arrest becomes convinced his neighbor is a serial killer.,0,0,0,1,0,0,1,0,0,0,0
"""21"" is the fact-based story about six MIT students who were trained to become experts in card counting and subsequently took Vegas casinos for millions in winnings.",0,0,0,1,0,0,1,0,0,0,0
"In 1950s New York, a lonely private detective afflicted with Tourette's Syndrome ventures to solve the murder of his mentor and only friend.",0,0,0,1,0,0,1,0,0,0,0
"An insight on the gritty life of a bored male, Chelsea football hooligan who lives for violence, sex, drugs & alcohol.",0,0,0,1,0,0,1,0,0,0,0
"An adaptation of the classic Dickens tale, where an orphan meets a pickpocket on the streets of London. From there, he joins a household of boys who are trained to steal for their master.",0,0,0,1,0,0,1,0,0,0,0
"A divorced woman and her diabetic daughter take refuge in their newly-purchased house's safe room, when three men break-in, searching for a missing fortune.",0,0,0,1,0,0,1,0,0,1,0
A retiring police detective pledges to catch the killer of a young child.,0,0,0,1,0,0,1,0,0,0,0
"Living in exile, Dr. Hannibal Lecter tries to reconnect with now disgraced F.B.I. Agent Clarice Starling, and finds himself a target for revenge from a powerful victim.",0,0,0,1,0,0,1,0,0,1,0
"A twisted take on ""Little Red Riding Hood"", with a teenage juvenile delinquent on the run from a social worker travelling to her grandmother's house and being hounded by a charming, but sadistic, serial killer and pedophile.",0,0,0,1,0,0,1,0,0,1,0
A group of skinheads become alarmed at the way their neighbourhood is changing.,0,0,0,1,0,0,1,0,0,1,0
"A woman who has lost her memory is taken in by a Los Angeles orphanage, and a private eye is enlisted to track down her identity, but he soon finds that he might have a past life connection to her that endangers their lives.",0,0,0,1,0,0,1,0,0,0,0
A detective investigating a series of murders becomes involved with a woman who may be the culprit.,0,0,0,1,0,0,1,0,0,0,0
A young actor's obsession with spying on a beautiful woman who lives nearby leads to a baffling series of events with drastic consequences.,0,0,0,1,0,0,1,0,0,0,0
"A millionaire offers $10,000 to five people who agree to be locked in a large, spooky, rented house overnight with him and his wife.",0,0,0,1,0,0,0,1,0,0,0
"A retired sheriff and his wife, grieving over the death of their son, set out to find their only grandson.",0,0,0,1,0,0,1,0,0,1,0
"Consummate con man Roy Courtnay has set his sights on his latest mark: the recently widowed Betty McLeish, worth millions. But this time, what should have been a simple swindle escalates into a cat-and-mouse game with the ultimate stakes.",0,0,0,1,0,0,1,0,0,0,0
"Years after walking away from her past as a young private eye, Veronica Mars gets pulled back to her hometown, just in time for her high school reunion, in order to help her old flame Logan Echolls, who's embroiled in a murder mystery.",0,0,0,1,0,0,1,0,0,0,0
"Kenny Wells, a prospector desperate for a lucky break, teams up with a similarly eager geologist and sets off on a journey to find gold in the uncharted jungle of Indonesia.",0,0,0,1,0,0,1,0,0,0,0
A rich man's daughter is held captive in an abandoned apartment by two former convicts who abducted her and hold her ransom in exchange for her father's money.,0,0,0,1,0,0,0,0,0,1,0
"When a protective father meets a murderous ex-con, both need to deviate from the path they are on as they soon find themselves entangled in a downwards spiral of lies and violence while having to confront their own inner psyche.",0,0,0,1,0,0,0,0,0,1,0
"A drama based on an ancient Chinese proverb that breaks life down into four emotional cornerstones: happiness, pleasure, sorrow and love. A businessman bets his life on a horse race; a gangster sees the future; a pop star falls prey to a crime boss; a doctor must save the love of his life.",0,0,0,1,0,0,1,0,0,1,0
"The murderous, backwoods Firefly family take to the road to escape the vengeful Sheriff Wydell, who is not afraid of being as ruthless as his target.",0,0,0,1,1,0,0,1,0,0,0
"A British mystery author visits her publisher's home in the South of France, where her interaction with his unusual daughter sets off some touchy dynamics.",0,0,0,1,0,0,1,0,0,0,0
"Spike Lee's take on the ""Son of Sam"" murders in New York City during the summer of 1977 centering on the residents of an Italian-American Northeast Bronx neighborhood who live in fear and distrust of one another.",0,0,0,1,0,0,1,0,1,0,0
A quadriplegic ex-homicide detective and his partner try to track down a serial killer who is terrorizing New York City.,0,0,0,1,0,0,1,0,0,0,0
A man heading to Vegas to pay off his gambling debt before the Russian mafia kills him is forced to stop in an Arizona town where everything that can go wrong does go wrong.,0,0,0,1,0,0,1,0,0,1,0
A boy blackmails his neighbor after suspecting him to be a Nazi war criminal.,0,0,0,1,0,0,1,0,0,1,0
Five different criminals face imminent death after botching a job quite badly.,0,0,0,1,0,0,1,0,0,1,0
A young boy who witnessed the suicide of a mafia lawyer hires an attorney to protect him when the District Attorney tries to use him to take down a mob family.,0,0,0,1,0,0,1,0,0,0,0
"A journalist duo go on a tour of serial killer murder sites with two companions, unaware that one of them is a serial killer himself.",0,0,0,1,0,0,1,0,0,1,0
"A young girl who has an amazing ability to communicate with insects is transferred to an exclusive Swiss boarding school, where her unusual capability might help solve a string of murders.",0,0,0,1,0,0,0,1,0,0,0
"Cherry drifts from college dropout to army medic in Iraq - anchored only by his true love, Emily. But after returning from the war with PTSD, his life spirals into drugs and crime as he struggles to find his place in the world.",0,0,0,1,0,0,1,0,0,0,0
An embattled NYPD detective is thrust into a citywide manhunt for a pair of cop killers after uncovering a massive and unexpected conspiracy.,0,0,0,1,0,0,1,0,0,1,0
An ex-convict working undercover intentionally gets himself incarcerated again in order to infiltrate the mob at a maximum security prison.,0,0,0,1,0,0,1,0,0,1,0
"When Brent turns down his classmate Lola's invitation to the prom, she concocts a wildly violent plan for revenge.",0,0,0,1,0,0,0,1,0,0,0
Terence McDonagh is a drug- and gambling-addled detective in post-Katrina New Orleans investigating the killing of five Senegalese immigrants.,0,0,0,1,0,0,1,0,0,0,0
"A father travels from Oklahoma to France to help his estranged daughter, who is in prison for a murder she claims she didn't commit.",0,0,0,1,0,0,1,0,0,1,0
A teenage skateboarder's life begins to fray after he is involved in the accidental death of a security guard.,0,0,0,1,0,0,1,0,0,0,0
A Transsiberian train journey from China to Moscow becomes a thrilling chase of deception and murder when an American couple encounters a mysterious pair of fellow travelers.,0,0,0,1,0,0,1,0,0,0,0
"The tale of two brothers with serious financial woes. When a third party proposes they turn to crime, things go badly and the two become enemies.",0,0,0,1,0,0,1,0,1,0,0
A perfect family's dynamic is ruined by a kidnapper's brutally efficient plot.,0,0,0,1,0,0,1,0,0,1,0
"A family's moral codes are tested when Ray Tierney investigates a case that reveals an incendiary police corruption scandal involving his own brother-in-law. For Ray, the truth is revelatory, a Pandora's Box that threatens to upend not only the Tierney legacy but the entire NYPD.",0,0,0,1,0,0,1,0,0,1,0
"When two married business executives having an affair are blackmailed by a violent criminal, the two must turn the tables on him to save their families.",0,0,0,1,0,0,1,0,0,1,0
"Jake Vig is a consummate grifter about to pull his biggest con yet, one set to avenge his friend's murder. But his last scam backfired, leaving him indebted to a mob boss and his enforcer.",0,0,0,1,0,0,0,0,0,1,0
Can an over-the-hill journalist uncover the evidence that can prove a death row inmate's innocence just hours before his execution?,0,0,0,1,0,0,1,0,0,0,0
A police detective uncovers a conspiracy behind a case involving a high-school guidance counselor when accusations of rape are made against him by two female students.,0,0,0,1,0,0,1,0,0,0,0
"A wealthy Wall Street speculator discovers that his wife has a lover. He investigates him and uses the carrot and stick to make him murder his wife. Planned to detail, it seems like a perfect murder.",0,0,0,1,0,0,1,0,0,1,0
"A visiting city reporter's assignment suddenly revolves around the murder trial of a local millionaire, whom he befriends.",0,0,0,1,0,0,1,0,0,0,0
Police hunting for a serial kidnapper are helped when a victim manages to escape for the first time.,0,0,0,1,0,0,1,0,0,0,0
"A law student uncovers a conspiracy, putting herself and others in danger.",0,0,0,1,0,0,1,0,0,0,0
A picture-perfect family is shattered when the work of a serial killer hits too close to home.,0,0,0,1,0,0,1,0,0,0,0
"Roman J. Israel, Esq., a driven, idealistic defense attorney, finds himself in a tumultuous series of events that lead to a crisis and the necessity for extreme action.",0,0,0,1,0,0,1,0,0,1,0
"Sam, a disenchanted young man, finds a mysterious woman swimming in his apartment's pool one night. The next morning, she disappears. Sam sets off across LA to find her, and along the way he uncovers a conspiracy far more bizarre.",0,0,0,1,0,0,1,0,0,0,0
"With instructions from her genius son's carefully crafted notebook, a single mother sets out to rescue a young girl from the hands of her abusive stepfather.",0,0,0,1,0,0,1,0,0,1,0
"The story of teenager Richard Wershe Jr., who became an undercover informant for the FBI during the 1980s and was ultimately arrested for drug-trafficking and sentenced to life in prison.",0,0,0,1,0,0,1,0,0,0,0
A divorcee becomes entangled in a missing persons investigation that promises to send shockwaves throughout her life.,0,0,0,1,0,0,1,0,0,0,0
Financial TV host Lee Gates and his producer Patty are put in an extreme situation when an irate investor takes them and their crew as hostage.,0,0,0,1,0,0,1,0,0,0,0
"Laurie Strode confronts her long-time foe, Michael Myers, the masked figure who has haunted her since she narrowly escaped his killing spree on Halloween night four decades ago.",0,0,0,1,0,0,0,1,0,1,0
"Tyler Gage receives the opportunity of a lifetime after vandalizing a performing arts school, gaining him the chance to earn a scholarship and dance with an up and coming dancer, Nora.",0,0,0,1,0,0,1,0,0,0,0
A Florida police chief must solve a vicious double homicide before he himself falls under suspicion.,0,0,0,1,0,0,1,0,0,0,0
A wealthy young man undergoing heart transplant surgery discovers that the surgical team intend to murder him.,0,0,0,1,0,0,1,0,0,0,0
"A woman framed for her husband's murder suspects he is still alive; as she has already been tried for the crime, she can't be re-prosecuted if she finds and kills him.",0,0,0,1,0,0,1,0,0,0,0
"A private investigator is hired to discover if a ""snuff film"" is authentic or not.",0,0,0,1,0,0,1,0,0,0,0
"After twenty-two years of psychiatric care, Norman Bates attempts to return to a life of solitude, but the specters of his crimes - and his mother - continue to haunt him.",0,0,0,1,0,0,0,1,0,0,0
"A video artist looking for work drives to a remote house in the forest to meet a man claiming to be a serial killer. But after agreeing to spend the day with him, she soon realizes that she made a deadly mistake.",0,0,0,1,0,0,1,1,0,0,0
An ex-con reunites with his estranged wayward 17-year old daughter to protect her from drug dealers who are trying to kill her.,0,0,0,1,0,0,1,0,0,0,0
An Alaska State Trooper partners with a young woman who escaped the clutches of serial killer Robert Hansen to bring the murderer to justice. Based on actual events.,0,0,0,1,0,0,0,0,0,1,0
"A normal Friday service at a fast food restaurant becomes interrupted by a police officer who claims an employee stole from a customer, but something more sinister is going on.",0,0,0,1,0,0,1,0,0,0,0
"When a madman begins committing horrific murders inspired by Edgar Allan Poe's works, a young Baltimore detective joins forces with Poe to stop him from making his stories a reality.",0,0,0,1,0,0,0,0,0,1,0
Psychic John Clancy (Sir Anthony Hopkins) works with the F.B.I. in order to hunt down a serial killer.,0,0,0,1,0,0,1,0,0,0,0
A group of criminals are brought together under mysterious circumstances and have to work together to uncover what's really going on when their simple job goes completely sideways.,0,0,0,1,0,0,1,0,0,0,0
A disgraced member of the Russian military police investigates a series of child murders during the Stalin-era Soviet Union.,0,0,0,1,0,0,1,0,0,0,0
"On his sprawling country estate, an aging writer matches wits with the struggling actor who has stolen his wife's heart.",0,0,0,1,0,0,1,0,0,0,0
"Walter Sparrow becomes obsessed with a novel that he believes was written about him, as more and more similarities between himself and his literary alter ego seem to arise.",0,0,0,1,0,0,0,0,0,1,0
"Political intrigue and deception unfold inside the United Nations, where a U.S. Secret Service agent is assigned to investigate an interpreter who overhears an assassination plot.",0,0,0,1,0,0,0,0,0,1,0
Daniel Ocean recruits one more team member so he can pull off three major European heists in this sequel to Ocean's Eleven (2001).,0,0,0,1,0,0,0,0,0,1,0
"An F.B.I. Agent persuades a social worker, who is adept with a new experimental technology, to enter the mind of a comatose serial killer in order to learn where he has hidden his latest kidnap victim.",0,1,0,1,0,0,0,1,0,0,0
"A wealthy attorney in San Juan comes to the police station for ""10 minutes"" of follow-up questions to finding a 12-year-old girl's body in a park. Another young girl was also raped and murdered weeks earlier and the evidence points to him.",0,0,0,1,0,0,1,0,0,1,0
"When the daughter of a well-known and well-respected base commander is murdered, an undercover detective is summoned to look into the matter and finds a slew of cover-ups at West Point.",0,0,0,1,0,0,1,0,0,0,0
"A tale about a happily married couple who would like to have children. Tracy teaches art, Andy's a college dean. Things are never the same after she is taken to hospital and operated upon by Jed, a ""know all"" doctor.",0,0,0,1,0,0,0,0,0,1,0
"Witness the making of Tony Soprano. The story that reveals the humanity behind Tony's struggles and the influence his family - especially his uncle, Dickie Moltisanti - had over him becoming the most iconic mob boss of all time.",0,0,0,1,0,0,1,0,0,0,0
A small-town sheriff sets out to find the two kids who have taken his car on a joy ride.,0,0,0,1,0,0,0,0,0,1,0
"A tight-knit team of rising investigators, along with their supervisor, is suddenly torn apart when they discover that one of their own teenage daughters has been brutally murdered.",0,0,0,1,0,0,1,0,0,0,0
An agoraphobic Seattle tech worker uncovers evidence of a crime.,0,0,0,1,0,0,1,0,0,1,0
"David Marks, a real estate scion, is suspected of killing his wife Katie, who disappeared in 1982.",0,0,0,1,0,0,1,0,0,0,0
"Kern County Deputy Sheriff Joe Deacon is sent to Los Angeles for what should have been a quick evidence-gathering assignment. Instead, he becomes embroiled in the search for a serial killer who is terrorizing the city.",0,0,0,1,0,0,1,0,0,0,0
Trainees in the FBI's psychological profiling program must put their training into practice when they discover a killer in their midst.,0,0,0,1,0,0,0,1,0,1,0
